{
  "$schema": "https://json-schema.org/draft/2020-12/schema",
  "$id": "https://tryashley.ai/contracts/instrument.schema.json",
  "title": "Instrument",
  "description": "A versioned, immutable interview instrument for one hourly role family: fixed core questions with anchored 1-5 rubrics. Any change to question or anchor text is a new version.",
  "type": "object",
  "additionalProperties": false,
  "required": ["instrument_id", "role_family", "version", "status", "rubric_scale", "questions", "content_hash"],
  "properties": {
    "instrument_id": {"type": "string", "pattern": "^[a-z0-9]+(-[a-z0-9]+)*$"},
    "role_family": {
      "enum": [
        "retail-associate", "customer-support", "warehouse-associate", "delivery-driver",
        "food-service", "call-center", "hospitality-front-desk", "healthcare-aide",
        "sales-development", "general-labor"
      ]
    },
    "version": {"type": "integer", "minimum": 1},
    "status": {"enum": ["draft", "active", "retired"]},
    "rubric_scale": {
      "type": "object",
      "additionalProperties": false,
      "required": ["min", "max"],
      "properties": {"min": {"const": 1}, "max": {"const": 5}}
    },
    "questions": {
      "type": "array",
      "minItems": 5,
      "maxItems": 12,
      "items": {"$ref": "#/$defs/question"}
    },
    "content_hash": {"type": "string", "pattern": "^sha256:[0-9a-f]{64}$"}
  },
  "$defs": {
    "question": {
      "type": "object",
      "additionalProperties": false,
      "required": ["question_id", "text", "competency", "follow_up_allowed", "anchors"],
      "properties": {
        "question_id": {"type": "string", "pattern": "^q[0-9]{2}$"},
        "text": {"type": "string", "minLength": 15},
        "competency": {"type": "string", "pattern": "^[a-z]+(-[a-z]+)*$"},
        "follow_up_allowed": {"type": "boolean"},
        "anchors": {
          "type": "object",
          "additionalProperties": false,
          "required": ["1", "3", "5"],
          "properties": {
            "1": {"type": "string", "minLength": 10},
            "3": {"type": "string", "minLength": 10},
            "5": {"type": "string", "minLength": 10}
          }
        }
      }
    }
  }
}
